Rang;n° rue;Nom rue;Code postal;Ville;Date création;Nom société;APE;Catégorie;Nbr employé;Mise à jour;Date finance;Revenu;Profit
959;45;RUE DU FAUBOURG DE ROUBAIX;59800;LILLE;2003;PARC EOLIEN DE LA SOLE DU BOIS;3511Z;Production d'électricité;0;2008-12-28T00:00:00;31/12/2015;2257108;1359263
960;;BOULEVARD DE TURIN;59777;LILLE;2008;MSE HAUT DE BANE;7112B;Ingénierie, études techniques;;2014-10-29T00:00:00;31/12/2015;2252393;1462318
961;374;RUE LEON GAMBETTA;59000;LILLE;2005;FRANCE-CHRIS;4722Z;Comm. détail viandes & produits à  base de viande (magas. spéc.);10;2014-04-06T00:00:00;31/08/2015;2251788;24728
962;;CTRE COMMERCIAL EURALILLE;59777;LILLE;2005;JPL 696;5610C;Restauration de type rapide;34;2016-08-09T00:00:00;31/12/2015;2240260;85531
963;130;BOULEVARD DE LA LIBERTE;59800;LILLE;2015;ERIVAL;7112B;Ingénierie, études techniques;0;2016-03-07T00:00:00;30/06/2015;2237367;541249
964;26;RUE LOUIS CHRISTIAENS;59800;LILLE;2003;RIDEAUX STORES SERVICES;9601A;Blanchisserie-teinturerie de gros;20;2008-12-19T00:00:00;31/03/2015;2232251;107740
965;5;PLACE DU GENERAL DE GAULLE;59800;LILLE;2007;SARL  AUX MERVEILLEUX;1071C;Boulangerie et boulangerie-pâtisserie;20;2008-03-12T00:00:00;31/07/2015;2227803;186841
966;67;RUE DE LA MONNAIE;59800;LILLE;2007;SARL  AUX MERVEILLEUX;1071C;Boulangerie et boulangerie-pâtisserie;20;2010-02-07T00:00:00;31/07/2015;2227803;186841
967;;RUE DU GRAND BUT LOMME;59160;LILLE;2003;ETS PETITPREZ ET LAMBAERE;9601B;Blanchisserie-teinturerie de détail;40;2003-09-16T00:00:00;31/12/2015;2216699;98573
968;300;RUE NATIONALE;59800;LILLE;1900;ETS PETITPREZ ET LAMBAERE;9601B;Blanchisserie-teinturerie de détail;40;1994-11-16T00:00:00;31/12/2015;2216699;98573
969;37;RUE INKERMANN;59000;LILLE;2008;V.L.C.PRODUCTION SARL;9002Z;Activités de soutien au spectacle vivant;1;2015-06-06T00:00:00;30/06/2015;2216001;2448
970;;BOULEVARD DE TURIN;59777;LILLE;2008;MSE BEAU REGARD;7112B;Ingénierie, études techniques;;2014-10-29T00:00:00;31/12/2015;2205997;908504
971;80;RUE DE JEMMAPES;59800;LILLE;2002;REGLE DE TROIS INSTITUT;7320Z;études de marché et sondages;31;2013-05-26T00:00:00;31/12/2015;2200851;257473
972;2;RUE PRINCESSE;59800;LILLE;2008;REGLE DE TROIS INSTITUT;7320Z;études de marché et sondages;31;2010-12-10T00:00:00;31/12/2015;2200851;257473
973;10;RUE DE PAS;59800;LILLE;1992;L'ECUME DES MERS;5610A;Restauration traditionnelle;20;2015-06-10T00:00:00;31/12/2015;2198648;79281
974;16;PLACE DU GENERAL DE GAULLE;59800;LILLE;2016;SINELCO FRANCE;4775Z;Comm. détail de parfumerie & produits de beauté en magasin spéc.;6;2016-12-08T00:00:00;30/09/2015;2188529;381074
975;77;BOULEVARD VAUBAN;59800;LILLE;2005;ATRIUM MAINTENANCE FRANCE;6311Z;Traitement de données, hébergement et activités connexes;48;2015-08-01T00:00:00;28/02/2015;2182468;-206224
976;;MARCHE D INTERET NATIONAL;59160;LILLE;1991;SPENNINCK SARL;4631Z;Commerce de gros (commerce interentreprises) de fruits et légumes;3;2010-02-25T00:00:00;31/01/2015;2181908;178569
977;681;AVENUE DE LA REPUBLIQUE;59800;LILLE;2015;THE FIRM ORGANISATION;7022Z;Conseil pour les affaires et autres conseils de gestion;3;2016-12-02T00:00:00;31/12/2015;2163310;375256
978;5;RUE DE L INNOVATION;59260;LILLE;2003;CAMPUS PRO;8559A;Formation continue d'adultes;11;2013-11-20T00:00:00;31/12/2015;2160273;331404
979;57;RUE NEGRIER;59800;LILLE;2016;FLANDRE ARTOIS RESTAURATION;5629B;Autres services de restauration n.c.a.;20;2016-05-03T00:00:00;31/12/2015;2142210;-136090
980;1;RUE DU PROFESSEUR CALMETTE;59800;LILLE;2000;GENOSCREEN;7211Z;Recherche-développement en biotechnologie;31;2013-08-13T00:00:00;31/12/2015;2136796;-243233
981;;RUE DE TOURNAI;59800;LILLE;2005;EFFIA STATIONNEMENT;5221Z;Services auxiliaires des transports terrestres;674;2014-04-12T00:00:00;31/12/2015;2130650;107032
982;69;RUE DE LA LOUVIERE;59800;LILLE;2015;EFFIA STATIONNEMENT;5221Z;Services auxiliaires des transports terrestres;674;2015-01-06T00:00:00;31/12/2015;2130650;107032
983;1;RUE DE L EUROPE;59000;LILLE;2010;TECAL-VERBRUGGE;2561Z;Traitement et revàªtement des métaux;20;2011-03-11T00:00:00;31/12/2015;2123880;15980
984;7;RUE DES ARTS;59800;LILLE;2010;DOM;4711C;Supérettes;6;2014-03-01T00:00:00;31/01/2015;2118984;12695
985;;PORT FLUVIAL 2EME AVENUE;59000;LILLE;1980;ETABLISSEMENTS MARANDIN;4520B;Entretien et réparation d'autres véhicules automobiles;18;2014-08-01T00:00:00;31/03/2015;2111814;72700
986;513;AVENUE WILLY BRANDT;59777;LILLE;2012;SOCIETE LUCIEN BARRIERE RESERVATIONS HOTELLERIE ET LOISIRS - SLBRHL;7010Z;Activités des sièges sociaux;40;2015-11-05T00:00:00;31/10/2015;2110344;-368977
987;4;RUE COURTOIS;59000;LILLE;2008;C.R.B.S;4399C;Travaux de maà§onnerie générale et gros oeuvre de bâtiment;20;2011-12-21T00:00:00;30/09/2015;2101681;141848
988;14;RUE LEPELLETIER;59800;LILLE;2000;SERIE NOIRE SARL;4751Z;Commerce de détail de textiles en magasin spécialisé;3;2015-07-10T00:00:00;28/02/2015;2098356;40082
989;7;SQUARE DUTILLEUL;59800;LILLE;1984;FONCIFRANCE;4110A;Promotion immobilière de logements;14;2015-09-02T00:00:00;31/12/2015;2093105;232517
990;26;RUE COLBERT;59000;LILLE;2012;GAEL AUTO ECOLE;8553Z;Enseignement de la conduite;20;2012-05-23T00:00:00;31/03/2015;2084680;28110
991;6;RUE DE L EUROPE LOMME;59160;LILLE;2013;ETABLISSEMENTS HAVET SA;4332B;Travaux de menuiserie métallique et serrurerie;20;2016-09-27T00:00:00;31/12/2015;2076448;54359
992;;BOULEVARD DE TURIN;59777;LILLE;2008;MSE SOLE DU MOULIN VIEUX;3511Z;Production d'électricité;;2014-11-25T00:00:00;31/12/2015;2074441;702975
993;38;BOULEVARD DE LA LIBERTE;59800;LILLE;2012;SARL ANIMAS FRANCE;7311Z;Activités des agences de publicité;3;2013-03-08T00:00:00;30/06/2015;2070361;125262
994;;RUE DE TOURNAI;59800;LILLE;2016;SSP PARIS;5610C;Restauration de type rapide;81;2016-08-09T00:00:00;30/09/2015;2068974;-95055
995;;PORT FLUVIAL;59000;LILLE;2016;NORDTECH;4651Z;Comm. de gros d'ordinat., d'éqpts informatiq. périph. & logiciels;0;2016-11-27T00:00:00;30/04/2015;2059972;-39030
996;253;BOULEVARD DE LEEDS;59777;LILLE;2012;PEARL IT CONSULTING;6202A;Conseil en systèmes et logiciels informatiques;6;2016-12-20T00:00:00;31/12/2015;2058416;35787
997;10;RUE PARRAYON;59800;LILLE;2010;SAS LE TRINQUET;6810Z;Activités des marchands de biens immobiliers;;2013-07-25T00:00:00;31/12/2015;2054943;169034
998;21;RUE DU FAUBOURG D'ARRAS;59000;LILLE;2007;R-TOM DISTRIBUTION;4643Z;Commerce de gros d'appareils électroménagers;4;2012-08-21T00:00:00;31/12/2015;2053643;61732
999;46;RUE SAINT ANDRE;59800;LILLE;2006;CABINET LORIEUX;6832A;Administration d'immeubles et autres biens immobiliers;28;2006-07-21T00:00:00;31/12/2015;2052934;89738
1000;4;RUE DES ARTS;59800;LILLE;1997;CABINET LORIEUX;6832A;Administration d'immeubles et autres biens immobiliers;28;2014-12-02T00:00:00;31/12/2015;2052934;89738
1001;;RUE MARCEL HENAUX;59000;LILLE;2004;PEINTURE LYS;4334Z;Travaux de peinture et vitrerie;15;2008-11-16T00:00:00;31/03/2015;2052378;103824
1002;3;RUE DE PARIS;59800;LILLE;1989;SOCIETE FINANCIERE FRANCHOIS LEGRAND;5510Z;Hà´tels et hébergement similaire;18;2016-10-06T00:00:00;31/03/2015;2049774;97718
1003;8;RUE COURTOIS;59000;LILLE;2011;TRANS MEDI SERVICE;4941B;Transports routiers de fret de proximité;31;2016-09-27T00:00:00;31/05/2015;2045095;111138
1004;35;QUAI DU WAULT;59800;LILLE;2007;PREAM;4110C;Promotion immobilière d'autres bâtiments;17;2014-08-24T00:00:00;31/12/2015;2042437;-645740
1005;;BOULEVARD DE TURIN;59777;LILLE;2011;MSE LE VIEUX MOULIN;3511Z;Production d'électricité;0;2014-11-16T00:00:00;31/12/2015;2039289;858042
1006;198;RUE NATIONALE;59800;LILLE;2013;SOLANO INVESTISSEMENTS;6420Z;Activités des sociétés holding;10;2014-06-30T00:00:00;31/12/2015;2030869;186736
1007;27;RUE DES TOURS;59800;LILLE;2003;HOTEL DES TOURS;5510Z;Hà´tels et hébergement similaire;13;2015-09-22T00:00:00;31/12/2015;2018953;-210240
1008;27;RUE DES TOURS;59800;LILLE;2003;HOTEL DES TOURS;5510Z;Hà´tels et hébergement similaire;13;2015-09-22T00:00:00;31/12/2015;2018953;-210240
1009;;CTRE COMMERCIAL EURALILLE;59777;LILLE;2014;WASQUEHAL BL;4645Z;Commerce de gros de parfumerie et de produits de beauté;10;2014-05-07T00:00:00;31/12/2015;2018878;-141337
1010;59;AVENUE DE LA REPUBLIQUE LOMME;59160;LILLE;2013;A.J.H DISTRI;4711D;Supermarchés;6;2014-04-04T00:00:00;30/09/2015;2018134;13440
1011;33;RUE DE LA JUSTICE;59000;LILLE;2011;TANK ARCHITECTES;7111Z;Activités d'architecture;10;2013-01-20T00:00:00;31/12/2015;2016512;95325
1012;;BOULEVARD DE TURIN;59777;LILLE;2008;MSE LE MONT DE PONCHE;7112B;Ingénierie, études techniques;;2015-03-20T00:00:00;31/12/2015;2009708;425972
1013;335;RUE LEON GAMBETTA;59000;LILLE;1988;EKLA DISTRIBUTION;4778A;Commerces de détail d'optique;10;2013-01-14T00:00:00;31/03/2015;2008407;386288
1014;1;RUE DU SEC AREMBAULT;59800;LILLE;1996;EKLA DISTRIBUTION;4778A;Commerces de détail d'optique;10;1996-09-30T00:00:00;31/03/2015;2008407;386288
1015;11;RUE BASSE;59800;LILLE;2012;K-WAY FRANCE;4771Z;Commerce de détail d'habillement en magasin spécialisé;6;2012-10-12T00:00:00;31/12/2015;1998842;37589
1016;2;ZAMIN 2EME AVENUE;59160;LILLE;2016;TAURUS INGENIERIE;4649Z;Commerce de gros d'autres biens domestiques;18;2016-11-25T00:00:00;31/12/2015;1993391;51041
1017;96;RUE NATIONALE;59800;LILLE;2016;PARC EOLIEN DE FRESNES-EN-SAULNOIS;3511Z;Production d'électricité;;2016-11-07T00:00:00;31/12/2015;1992555;554717
1018;15;PLACE DES REIGNAUX;59800;LILLE;2002;SONOR PLUS;4743Z;Commerce de détail de matériels audio/vidéo en magasin spécialisé;6;2003-03-19T00:00:00;30/06/2015;1978841;-13082
1019;11;PARVIS DE ROTTERDAM;59777;LILLE;2014;EUROSCO;5221Z;Services auxiliaires des transports terrestres;;2016-09-07T00:00:00;31/12/2015;1971688;-42564
1020;45;RUE DU FAUBOURG DE ROUBAIX;59800;LILLE;2003;PARC EOLIEN LES TREIZE;3511Z;Production d'électricité;0;2011-05-13T00:00:00;31/12/2015;1967394;-25851
1021;229;RUE SOLFERINO;59000;LILLE;1996;JEAN LUC DENIS;4333Z;Travaux de revàªtement des sols et des murs;20;1996-11-19T00:00:00;31/12/2015;1965478;-41386
1022;7;BOULEVARD LOUIS XIV;59800;LILLE;1998;VESTA;5530Z;Terrains de camping et parcs pour caravanes, véhicules de loisirs;41;2016-08-12T00:00:00;31/12/2015;1948325;21337
1023;253;BOULEVARD DE LEEDS;59777;LILLE;2015;PROTECTION +;8010Z;Activités de sécurité privée;10;2015-06-12T00:00:00;31/12/2015;1942149;95972
1024;67;RUE DE LUXEMBOURG;59777;LILLE;2004;BETON CONSTRUCT;4399C;Travaux de maà§onnerie générale et gros oeuvre de bâtiment;0;2015-11-13T00:00:00;31/12/2015;1928268;70431
1025;45;RUE DU FAUBOURG DE ROUBAIX;59800;LILLE;2003;PARC EOLIEN DE SAINT LEGER;3511Z;Production d'électricité;0;2011-05-13T00:00:00;30/09/2015;1926915;867913
1026;28;RUE DES PONTS DE COMINES;59800;LILLE;2011;CROCBOOK FRANCE;4761Z;Commerce de détail de livres en magasin spécialisé;17;2012-02-09T00:00:00;30/06/2015;1923370;41700
1027;11;PARVIS DE ROTTERDAM;59777;LILLE;2015;JP SERWICES LOGISTIC TRANSPORTS;4649Z;Commerce de gros d'autres biens domestiques;0;2016-09-18T00:00:00;31/12/2015;1921497;-44145
1028;4;MARCHE D INTERET NATIONAL;59160;LILLE;2009;SAVEURS AU QUOTIDIEN;4631Z;Commerce de gros (commerce interentreprises) de fruits et légumes;4;2015-11-19T00:00:00;31/12/2015;1920356;-18679
1029;;MARCHE D INTERET NATIONAL;59160;LILLE;2005;SARL BENOIT DELPORTE;4631Z;Commerce de gros (commerce interentreprises) de fruits et légumes;6;2013-01-13T00:00:00;30/09/2015;1907989;41505
1030;46;RUE NEGRIER;59800;LILLE;2009;LES CHAIS DU SAVOUR;4725Z;Commerce de détail de boissons en magasin spécialisé;12;2011-06-01T00:00:00;31/12/2015;1907904;-891280
1031;8;ZAMIN 2EME AVENUE;59160;LILLE;1985;S O P A F O M;7732Z;Location et location-bail machines & équipts pour la construction;20;2000-05-23T00:00:00;31/12/2015;1907586;-224311
1032;;BOULEVARD DE TURIN;59777;LILLE;2008;MSE LE HAUT DE LA VAUSSE;7112B;Ingénierie, études techniques;;2014-11-25T00:00:00;31/12/2015;1900669;1122008
1033;43;RUE BASSE;59800;LILLE;2008;C347;1413Z;Fabrication de vàªtements de dessus;10;2016-07-29T00:00:00;30/09/2015;1899234;-264454
1034;125;RUE DU MARCHE;59000;LILLE;2015;DE ALZUA;7111Z;Activités d'architecture;20;2015-12-11T00:00:00;31/03/2015;1897125;16709
1035;;BOULEVARD DE TURIN;59777;LILLE;2008;MSE LE BOUTONNIER;7112B;Ingénierie, études techniques;;2014-11-19T00:00:00;31/12/2015;1897071;1021185
1036;;AVENUE DE LA ROTONDE;59160;LILLE;2010;MIDITRACAGE LILLE;4211Z;Construction de routes et autoroutes;11;2016-11-24T00:00:00;30/09/2015;1890957;3445
1037;165;AVENUE DE LA BRETAGNE;59000;LILLE;2015;STARDUST;6209Z;Autres activités informatiques;20;2016-02-14T00:00:00;31/12/2015;1889031;59071
1038;69;RUE MASSENA;59800;LILLE;2014;DEV PRESS;9601B;Blanchisserie-teinturerie de détail;21;2014-11-27T00:00:00;31/12/2015;1888239;32305
1039;24;PLACE DE LA GARE;59800;LILLE;2002;BALLADINS LILLE;5510Z;Hà´tels et hébergement similaire;11;2007-10-23T00:00:00;31/12/2015;1867552;248365
1040;;RUE E IMBERT DE LA PHALECQUE;59160;LILLE;1997;LILLE KARTING INDOOR SA;8551Z;Enseignement de disciplines sportives et d'activités de loisirs;20;1997-03-06T00:00:00;31/12/2015;1858582;21684
1041;2;RUE ST VINCENT DE PAUL;59160;LILLE;2013;THERMO TRANS EXPRESS;4941B;Transports routiers de fret de proximité;10;2016-07-21T00:00:00;31/12/2015;1852876;52977
1042;12;RUE DE PARIS;59800;LILLE;2010;LE MEURIN LILLE;5610A;Restauration traditionnelle;29;2015-02-08T00:00:00;30/09/2015;1850519;7171
1043;10;RUE DE PARIS;59800;LILLE;2010;LE MEURIN LILLE;5610A;Restauration traditionnelle;29;2011-01-06T00:00:00;30/09/2015;1850519;7171
1044;35;PLACE RIHOUR;59800;LILLE;2000;FUN FOOD;5610A;Restauration traditionnelle;30;2015-12-06T00:00:00;31/12/2015;1849855;4879
1045;51;RUE D ARCOLE;59000;LILLE;1989;METALLISATION NORD INDUSTRIE;2561Z;Traitement et revàªtement des métaux;9;2015-09-05T00:00:00;31/12/2015;1845125;221241
1046;256;BOULEVARD VICTOR HUGO;59000;LILLE;2004;SARL MERY;4942Z;Services de déménagement;20;2006-02-08T00:00:00;31/12/2015;1842124;66710
1047;165;AVENUE DE LA BRETAGNE;59000;LILLE;2013;IKUMBI SOLUTIONS;7022Z;Conseil pour les affaires et autres conseils de gestion;20;2013-10-10T00:00:00;31/12/2015;1841481;148197
1048;3;MARCHE D INTERET NATIONAL;59160;LILLE;2012;FOUKRA;4631Z;Commerce de gros (commerce interentreprises) de fruits et légumes;1;2012-03-19T00:00:00;31/12/2015;1830935;21354
1049;130;BOULEVARD DE LA LIBERTE;59800;LILLE;2015;SARL LAMBERT & FONTAINE DEPAUW;4673B;Commerce de gros d'appareils sanitaires et produits de décoration;1;2016-07-26T00:00:00;31/12/2015;1830886;49993
1050;14;PLACE DU GENERAL DE GAULLE;59800;LILLE;1999;INTERVIEW;7320Z;études de marché et sondages;44;1999-04-30T00:00:00;31/12/2015;1829646;135729
1051;351;RUE VICTOR HUGO;59260;LILLE;2001;LEMAIRE CHRISTIAN SOC;4332A;Travaux de menuiserie bois et PVC;10;2012-07-18T00:00:00;31/12/2015;1815933;176798
1052;15;RUE JACQUEMARS GIELEE;59800;LILLE;2000;ABATIS;9529Z;Réparation d'autres biens personnels et domestiques;10;2016-09-21T00:00:00;30/09/2015;1808340;10179
1053;61;RUE DE LA MONNAIE;59800;LILLE;2004;SORELLI FRATELLI;4711B;Commerce d'alimentation générale;20;2013-07-19T00:00:00;31/03/2015;1807652;118366
1054;8;RUE AU PETERINCK;59800;LILLE;1997;SORELLI FRATELLI;4711B;Commerce d'alimentation générale;20;2013-06-19T00:00:00;31/03/2015;1807652;118366
1055;239;RUE DU JARDIN DES PLANTES;59000;LILLE;2010;ECOLE SUPERIEURE DE COMMUNICATION PUBLICITE ET MARKETING DE LILLE;8542Z;Enseignement supérieur;20;2014-07-29T00:00:00;31/08/2015;1806873;255423
1056;31;AVENUE DU PEUPLE BELGE;59800;LILLE;2015;GO DESTOCKS;4690Z;Commerce de gros (commerce interentreprises) non spécialisé;;2015-08-30T00:00:00;31/12/2015;1805957;-839459
1057;49;RUE DE PARIS;59800;LILLE;1981;SOC EXPLOITATION ETS HENRY HURET;4778C;Autres commerces de détail spécialisés divers;6;2012-09-25T00:00:00;31/01/2015;1805577;29090
1058;23;BOULEVARD CARNOT;59800;LILLE;2014;INTERACTION NORD;7820Z;Activités des agences de travail temporaire;8;2014-04-16T00:00:00;31/12/2015;1804955;-39253
1059;36;RUE DE L HOPITAL MILITAIRE;59800;LILLE;2006;MADE IN SURVEYS;7320Z;études de marché et sondages;20;2015-07-04T00:00:00;31/12/2015;1796209;286329
1060;144;RUE NATIONALE;59800;LILLE;2013;BCS IMMOBILIER;6831Z;Agences immobilières;20;2013-07-29T00:00:00;31/12/2015;1788388;108612
1061;213;AVENUE DE DUNKERQUE;59000;LILLE;2004;BCS IMMOBILIER;6831Z;Agences immobilières;20;2004-02-18T00:00:00;31/12/2015;1788388;108612
1062;98;BOULEVARD DE LA LIBERTE;59800;LILLE;2008;BCS IMMOBILIER;6831Z;Agences immobilières;20;2008-10-08T00:00:00;31/12/2015;1788388;108612
1063;40;RUE LEON GAMBETTA;59000;LILLE;1998;BCS IMMOBILIER;6831Z;Agences immobilières;20;2015-06-13T00:00:00;31/12/2015;1788388;108612
1064;132;RUE LEON GAMBETTA;59000;LILLE;2009;F.J.B & CO;4779Z;Commerce de détail de biens d'occasion en magasin;9;2016-01-17T00:00:00;31/12/2015;1786180;27768
1065;87;RUE NATIONALE;59800;LILLE;2001;CEPRO;4618Z;Interm. spécialisés commerce d'autres produits spécifiques;3;2015-03-25T00:00:00;31/12/2015;1785975;51270
1066;14;RUE DE PUEBLA;59800;LILLE;2009;J.R.P. INVESTISSEMENT;6810Z;Activités des marchands de biens immobiliers;0;2010-09-21T00:00:00;31/12/2015;1774439;40067
1067;250;RUE MADELEINE REBERIOUX;59000;LILLE;2015;POWERLING;7430Z;Traduction et interprétation;10;2016-12-21T00:00:00;31/12/2015;1769529;54979
1068;45;RUE DE LA CLEF;59800;LILLE;2013;L'ATELIER AMELOT PARIS;1330Z;Ennoblissement textile;6;2016-01-12T00:00:00;31/03/2015;1766678;-174693
1069;27;AVENUE DU PRESIDENT KENNEDY;59800;LILLE;2006;ETABLISSEMENTS PORQUET ET FILS;4332B;Travaux de menuiserie métallique et serrurerie;13;2007-02-05T00:00:00;31/12/2015;1762526;80884
1070;269;RUE ROGER SALENGRO (HELLEMMES);59260;LILLE;2014;SEBMADIS;4711D;Supermarchés;6;2015-05-07T00:00:00;30/11/2015;1748362;46129
1071;2;ZAMIN 1ERE AVENUE;59160;LILLE;2009;SDL;4690Z;Commerce de gros (commerce interentreprises) non spécialisé;1;2016-12-23T00:00:00;31/12/2015;1747689;7791
1072;31;RUE DE LA CLEF;59800;LILLE;2014;NO MERCY;4642Z;Commerce de gros d'habillement et de chaussures;4;2014-03-11T00:00:00;28/02/2015;1740284;-303338
1073;3;RUE ERNEST DECONYNCK;59800;LILLE;1989;SMILE CLUB;5630Z;Débits de boissons;10;2013-02-06T00:00:00;31/12/2015;1732169;307995
1074;25;RUE DU MOLINEL;59800;LILLE;2016;ACTUAL LILLE CENTRE;7820Z;Activités des agences de travail temporaire;1;2016-11-24T00:00:00;31/12/2015;1724566;35238
1075;289;RUE SOLFERINO;59000;LILLE;2013;VACHERAND IMMOBILIER;6810Z;Activités des marchands de biens immobiliers;10;2014-03-03T00:00:00;31/12/2015;1724372;87112
1076;255;RUE NATIONALE;59800;LILLE;1997;VACHERAND IMMOBILIER;6810Z;Activités des marchands de biens immobiliers;10;2012-06-12T00:00:00;31/12/2015;1724372;87112
1077;100;CTRE COMMERCIAL EURALILLE;59777;LILLE;2010;ZONE FRANCHE;4771Z;Commerce de détail d'habillement en magasin spécialisé;10;2011-07-26T00:00:00;30/06/2015;1723597;-208437
1078;107;RUE ROYALE;59800;LILLE;2013;2MEM STOCK;4690Z;Commerce de gros (commerce interentreprises) non spécialisé;1;2014-01-27T00:00:00;31/03/2015;1708282;3060
1079;2;PLACE DE BETHUNE;59800;LILLE;2000;SAGUER;5610A;Restauration traditionnelle;24;2014-05-02T00:00:00;31/03/2015;1705792;66661
1080;43;RUE FAIDHERBE;59000;LILLE;2012;SURFJOB;7022Z;Conseil pour les affaires et autres conseils de gestion;20;2013-02-08T00:00:00;31/12/2015;1698814;41547
1081;4;PARVIS ST MAURICE;59800;LILLE;2011;INSTITUT DE COMMUNICATION LILLOIS;8559B;Autres enseignements;11;2016-11-25T00:00:00;31/08/2015;1694449;98740
1082;10;RUE FAIDHERBE;59000;LILLE;2014;BUFFALO BURGER;5610A;Restauration traditionnelle;54;2016-02-07T00:00:00;31/12/2015;1684425;-1743451
1083;88;RUE ESQUERMOISE;59800;LILLE;2010;CARRELAGES DU MARAIS BERTRAND DAMOISEAU;4673B;Commerce de gros d'appareils sanitaires et produits de décoration;7;2015-02-27T00:00:00;30/09/2015;1668157;45180
1084;73;RUE LEON GAMBETTA;59000;LILLE;2010;LCR DISTRI;4711C;Supérettes;6;2016-08-05T00:00:00;30/11/2015;1663694;66261
1085;30;RUE DU MOLINEL;59800;LILLE;2015;SPORTS CONSEILS MANAGEMENT  SPOCOM;8559A;Formation continue d'adultes;20;2016-02-02T00:00:00;31/12/2015;1661002;159669
1086;11;RUE JULES MOUSSERON;59160;LILLE;2005;S.E.T.S. CHIORINO NORD;4669B;Commerce de gros de fournitures et équipements industriels divers;9;2014-12-06T00:00:00;31/12/2015;1659878;181504
1087;90;RUE DU MOLINEL;59800;LILLE;2008;ANACOURS;8559B;Autres enseignements;20;2008-09-11T00:00:00;31/07/2015;1642144;54978
1088;283;RUE DU FAUBOURG DES POSTES;59000;LILLE;1962;ETS OLIVER;4669B;Commerce de gros de fournitures et équipements industriels divers;6;2015-07-04T00:00:00;31/12/2015;1641923;137472
1089;2;ALLEE DE LA HAYE DU TEMPLE;59000;LILLE;2014;STEREOGRAPH;5829B;Edition de logiciels outils de développement et de langages;20;2016-09-01T00:00:00;31/12/2015;1624165;-1467717
1090;1;RUE MOULINS DE GARANCE;59800;LILLE;2014;HOTELIL;5510Z;Hà´tels et hébergement similaire;10;2015-11-19T00:00:00;31/12/2015;1622367;153634
1091;8;AVENUE LEON JOUHAUX;59800;LILLE;2005;GUINGUETTE DE LA MARINE;5610A;Restauration traditionnelle;12;2016-12-07T00:00:00;31/12/2015;1622160;79677
1092;3;RUE BAYARD;59000;LILLE;2007;EXPLICITE;6920Z;Activités comptables;11;2016-12-22T00:00:00;30/09/2015;1621986;67267
1093;28;CTRE COMMERCIAL EURALILLE;59777;LILLE;1994;HARCOURT;4772A;Commerce de détail de la chaussure;6;1995-12-05T00:00:00;31/12/2015;1619716;54028
1094;26;RUE LEPELLETIER;59800;LILLE;1998;SARL LES COMPAGNONS DE LA GRAPPE;5610A;Restauration traditionnelle;14;2014-03-21T00:00:00;30/06/2015;1619149;114317
1095;96;RUE NATIONALE;59800;LILLE;2016;STE EXPLOITATION PARC EOLIEN FOND GEROME;3511Z;Production d'électricité;0;2016-11-07T00:00:00;31/12/2015;1618486;728434
1096;11;RUE JEAN ROISIN;59800;LILLE;2005;LA COMPAGNIE DES MENUISIERS DE FRANCE;4618Z;Interm. spécialisés commerce d'autres produits spécifiques;6;2016-09-27T00:00:00;30/09/2015;1616220;262683
1097;154;RUE LEON GAMBETTA;59000;LILLE;2003;SARL LE BATEAU LIVRE;4761Z;Commerce de détail de livres en magasin spécialisé;6;2014-06-27T00:00:00;31/12/2015;1615003;79790
1098;45;RUE DU FAUBOURG DE ROUBAIX;59800;LILLE;2004;PARC EOLIEN HOMBLEUX 1;3511Z;Production d'électricité;0;2011-05-13T00:00:00;30/09/2015;1604448;488736
1099;677;AVENUE DE LA REPUBLIQUE;59800;LILLE;2015;ZELIG CONSULTANTS;6202A;Conseil en systèmes et logiciels informatiques;10;2016-05-12T00:00:00;31/12/2015;1584244;52621
1100;14;RUE DU VIEUX FAUBOURG;59800;LILLE;2012;ARTOIS AUDIT;6920Z;Activités comptables;20;2013-02-03T00:00:00;30/06/2015;1580997;170182
1101;126;RUE DE LA LOUVIERE;59800;LILLE;2006;CAP FIDELIS;6622Z;Activités des agents et courtiers d'assurances;3;2012-01-19T00:00:00;31/12/2015;1579339;394988
1102;4;RUE ST PIERRE ST PAUL;59000;LILLE;1988;SONOLYS SA;1330Z;Ennoblissement textile;10;1992-08-20T00:00:00;30/06/2015;1577060;112520
1103;7;RUE NATIONALE;59800;LILLE;2014;F2G  FASHION GARELLA GALLERY;4771Z;Commerce de détail d'habillement en magasin spécialisé;10;2014-02-14T00:00:00;31/12/2015;1576507;-74401
1104;71;RUE DE BETHUNE;59800;LILLE;1955;BRASSERIE ANDRE;5610A;Restauration traditionnelle;10;2012-02-23T00:00:00;31/12/2015;1572003;107793
1105;217;RUE FENELON LOMME;59160;LILLE;2011;ATRIUM SERVICES;8122Z;Autres activités nettoyage des bâtiments et nettoyage industriel;45;2013-12-10T00:00:00;31/12/2015;1571363;111587
1106;83;RUE COLBERT;59000;LILLE;2008;LA MAISON DU PIANO;4778C;Autres commerces de détail spécialisés divers;6;2009-09-29T00:00:00;30/06/2015;1567867;114530
1107;96;RUE NATIONALE;59800;LILLE;2016;SOCIETE D'EXPLOITATION DU PARC EOLIEN LE MONT D'HEZECQUES;3511Z;Production d'électricité;0;2016-11-07T00:00:00;31/12/2015;1562286;750504
1108;;BOULEVARD DE TURIN;59777;LILLE;2008;MSE LA SAURUPT;7112B;Ingénierie, études techniques;;2015-11-22T00:00:00;31/12/2015;1556304;485123
1109;62;RUE DE CANNES;59000;LILLE;2009;PERF.U.LOR LILLE;4774Z;Comm. détail d'articles médicaux & orthopédiques en magasin spéc.;6;2011-01-30T00:00:00;31/12/2015;1541008;345845
1110;16;PLACE DU GENERAL DE GAULLE;59800;LILLE;1992;LOCATOUR NORD;4778B;Commerces de détail de charbons et combustibles;0;2014-01-09T00:00:00;31/12/2015;1530947;22987
1111;253;BOULEVARD DE LEEDS;59777;LILLE;2013;UNI.CALL;8299Z;Autres activités de soutien aux entreprises n.c.a.;28;2016-12-30T00:00:00;31/12/2015;1522100;54260
1112;96;RUE DE PARIS;59800;LILLE;2014;O2 LILLE EST;7830Z;Autre mise à  disposition de ressources humaines;49;2016-05-15T00:00:00;31/12/2015;1518351;-44756
1113;27;RUE LEPELLETIER;59800;LILLE;2014;SPACE;4771Z;Commerce de détail d'habillement en magasin spécialisé;10;2014-11-16T00:00:00;31/12/2015;1517619;10346
1114;141;RUE DE DOUAI;59000;LILLE;2012;O2 LILLE OUEST;7830Z;Autre mise à  disposition de ressources humaines;50;2015-08-18T00:00:00;31/12/2015;1511315;-50841
1115;22;RUE JEAN BART;59000;LILLE;2000;LES ENCHANTEURS;7311Z;Activités des agences de publicité;10;2015-02-17T00:00:00;31/12/2015;1511279;32081
1116;357;RUE LEON GAMBETTA;59000;LILLE;1991;HDM;4723Z;Comm. détail poissons crustacés & mollusques (magasin spécialisé);9;2013-12-27T00:00:00;30/09/2015;1502790;103703
1117;;PLACE DU GENERAL DE GAULLE;59800;LILLE;2007;PRB EXPLOIT;4772B;Commerce de détail de maroquinerie et d'articles de voyage;20;2007-09-21T00:00:00;31/01/2015;1489730;-150138
1118;102;PAVE DU MOULIN;59260;LILLE;1992;LUDINA FRANCE SARL;4399D;Autres travaux spécialisés de construction;5;2016-02-16T00:00:00;31/12/2015;1485547;103937
1119;22;RUE ESQUERMOISE;59800;LILLE;1987;KERLINE;9602A;Coiffure;20;2015-06-13T00:00:00;31/12/2015;1483416;142530
1120;2;AVENUE DU PEUPLE BELGE;59800;LILLE;2012;COTTESLOE;6420Z;Activités des sociétés holding;10;2014-02-09T00:00:00;31/12/2015;1478881;-112272
1121;33;PLACE LOUISE DE BETTIGNIES;59800;LILLE;2012;COTTESLOE;6420Z;Activités des sociétés holding;10;2013-04-03T00:00:00;31/12/2015;1478881;-112272
1122;33;PLACE LOUISE DE BETTIGNIES;59800;LILLE;2010;COTTESLOE;6420Z;Activités des sociétés holding;10;2014-02-09T00:00:00;31/12/2015;1478881;-112272
