Rang;n° rue;Nom rue;Code postal;Ville;Date création;Nom société;APE;Catégorie;Nbr employé;Mise à jour;Date finance;Revenu;Profit
1619;3;RUE JEANNE MAILLOTTE;59800;LILLE;2015;COMPAGNIE D'ETUDES ET DE TRANSACTIONS IMMOBILIERES CETIM;6831Z;Agences immobilières;0;2016-10-16T00:00:00;31/03/2015;369351;-222358
1620;463;RUE LEON GAMBETTA;59000;LILLE;2011;PHARMACIE GALLER;4773Z;Commerce de détail produits pharmaceutiques (magasin spécialisé);1;2012-04-12T00:00:00;30/09/2015;368676;-37933
1621;130;RUE DU GRAND BUT LOMME;59160;LILLE;2015;CAJEVA;4724Z;Comm. détail pain pâtisserie & confiserie (magasin spécialisé);3;2015-07-21T00:00:00;30/09/2015;368464;35237
1622;84;RUE DE MARQUILLIES;59000;LILLE;2015;VIRTUAL TOUCH;6201Z;Programmation informatique;1;2015-02-09T00:00:00;31/12/2015;366671;41061
1623;22;RUE ANATOLE FRANCE;59000;LILLE;2010;MADER CONSEIL;7010Z;Activités des sièges sociaux;1;2016-08-02T00:00:00;31/12/2015;365634;14794
1624;130;BOULEVARD DE LA LIBERTE;59800;LILLE;2015;ORAKEL;4649Z;Commerce de gros d'autres biens domestiques;1;2015-12-11T00:00:00;31/12/2015;365093;2432
1625;16;BOULEVARD VAUBAN;59800;LILLE;2014;SEIZE IMMOBILIER;6831Z;Agences immobilières;3;2014-12-02T00:00:00;31/12/2015;364216;129545
1626;;PORT FLUVIAL;59000;LILLE;2011;EXECUTE;1813Z;Activités de pré-presse;1;2015-09-05T00:00:00;31/12/2015;362153;8317
1627;105;BOULEVARD VICTOR HUGO;59000;LILLE;2007;LEUCCI;5610C;Restauration de type rapide;6;2016-09-23T00:00:00;30/09/2015;362025;-3566
1628;104;RUE NATIONALE;59800;LILLE;2015;CONSEIL EN PRATIQUES & ANALYSES SOCIALES;7022Z;Conseil pour les affaires et autres conseils de gestion;6;2016-12-16T00:00:00;31/12/2015;361840;-99460
1629;80;RUE DE PARIS;59800;LILLE;2015;MOD IS MINE;4771Z;Commerce de détail d'habillement en magasin spécialisé;20;2016-08-25T00:00:00;31/12/2015;357281;33733
1630;13;RUE VAUCANSON;59800;LILLE;1995;SYDELEC;4321A;Travaux d'installation électrique dans tous locaux;3;2011-07-27T00:00:00;30/06/2015;357199;26869
1631;361;RUE LEON GAMBETTA;59000;LILLE;2000;ROSARIO ET FILS;3250A;Fabrication de matériel médico-chirurgical et dentaire;1;2012-02-08T00:00:00;30/06/2015;356875;-17415
1632;11;PLACE PIERRE MENDES FRANCE;59800;LILLE;2013;SARL BERGAOUI;5610A;Restauration traditionnelle;1;2014-06-30T00:00:00;31/12/2015;355748;50002
1633;171;RUE NATIONALE;59800;LILLE;1999;OLIVIER DUQUESNOY IMMOBILER;6810Z;Activités des marchands de biens immobiliers;0;2000-07-27T00:00:00;30/06/2015;354110;-242121
1634;;RUE DES FRERES LUMIERE LOMME;59160;LILLE;2006;V COM VOUS;7311Z;Activités des agences de publicité;1;2012-01-10T00:00:00;31/12/2015;353365;29942
1635;30;RUE CAUMARTIN;59000;LILLE;2001;COSSEE DE MAULDE;7111Z;Activités d'architecture;1;2015-09-23T00:00:00;31/12/2015;349712;101621
1636;9;PLACE DE LA SOLIDARITE;59000;LILLE;2010;SARL O.F.C;4639B;Commerce de gros alimentaire non spécialisé;1;2015-02-04T00:00:00;31/12/2015;348820;480
1637;129;RUE DE DOUAI;59000;LILLE;1995;FRANCK CREPELLE SARL;4334Z;Travaux de peinture et vitrerie;4;2000-11-24T00:00:00;31/12/2015;348665;26885
1638;35;QUAI DU WAULT;59800;LILLE;2010;AUBERS 10;4110A;Promotion immobilière de logements;;2014-08-28T00:00:00;31/12/2015;348482;26653
1639;24;BOULEVARD DE LA LIBERTE;59800;LILLE;2011;CABINET GLV IMMOBILIER;6831Z;Agences immobilières;3;2013-02-03T00:00:00;31/12/2015;346246;77113
1640;165;BOULEVARD DE LA LIBERTE;59800;LILLE;2015;CABINET GLV IMMOBILIER;6831Z;Agences immobilières;3;2016-01-04T00:00:00;31/12/2015;346246;77113
1641;14;RUE DU VIEUX FAUBOURG;59800;LILLE;2016;NORD EST PROPRETE;8121Z;Nettoyage courant des bâtiments;10;2016-12-29T00:00:00;31/12/2015;344079;11871
1642;10;AVENUE FOCH;59800;LILLE;2013;SAS CENTRE D'AFFAIRES DU PARC LUMIERE;6820B;Location de terrains et d'autres biens immobiliers;6;2013-03-13T00:00:00;31/12/2015;342987;28205
1643;19;BOULEVARD CARNOT;59800;LILLE;2003;SARL ADEQUAT;4332B;Travaux de menuiserie métallique et serrurerie;2;2012-07-12T00:00:00;30/09/2015;341423;6968
1644;31;RUE DES PONTS DE COMINES;59800;LILLE;2003;ELEPHANT THAI;5610A;Restauration traditionnelle;4;2014-01-28T00:00:00;31/03/2015;341211;54734
1645;1;RUE JACQUARD HELLEMMES;59260;LILLE;2013;JOHN BCD;4771Z;Commerce de détail d'habillement en magasin spécialisé;2;2013-05-07T00:00:00;30/09/2015;337741;-198735
1646;130;RUE DU GRAND BUT LOMME;59160;LILLE;2012;YOKOHAMA;5610A;Restauration traditionnelle;9;2012-04-10T00:00:00;30/06/2015;337526;5071
1647;34;PLACE DU GENERAL DE GAULLE;59800;LILLE;1998;EXCEPTION;7810Z;Activités des agences de placement de main-d'oeuvre;3;2014-10-07T00:00:00;31/12/2015;336854;7133
1648;12;RUE THIERS;59800;LILLE;2012;SARL ANNADO;5610A;Restauration traditionnelle;5;2015-04-04T00:00:00;30/09/2015;336102;15559
1649;11;PARVIS DE ROTTERDAM;59777;LILLE;2014;EURO-TRANSMANCHE 3 NPC;6630Z;Gestion de fonds;20;2016-07-21T00:00:00;31/12/2015;335650;-2563144
1650;10;RUE DES PONTS DE COMINES;59800;LILLE;2014;VALLEE LUNE CREATEUR VOYAGES;7912Z;Activités des voyagistes;0;2014-03-12T00:00:00;30/04/2015;333583;-8447
1651;56;PLACE DU GENERAL DE GAULLE;59800;LILLE;2005;EURL MLD;5610A;Restauration traditionnelle;3;2016-01-17T00:00:00;31/12/2015;331819;-217835
1652;128;RUE DU FAUBOURG DE DOUAI;59000;LILLE;1999;NORLOC;4649Z;Commerce de gros d'autres biens domestiques;0;2010-01-17T00:00:00;31/12/2015;327304;6577
1653;16;RUE ST JACQUES;59800;LILLE;2005;JM PANHALEUX LUTHIER ARCHETIER;9529Z;Réparation d'autres biens personnels et domestiques;3;2007-06-27T00:00:00;31/12/2015;326908;44646
1654;10;RUE ST JEAN BAPTISTE DE SALLE;59000;LILLE;2003;SOCIETE DE GESTION DE RESIDENCES SGR;6820B;Location de terrains et d'autres biens immobiliers;3;2003-11-19T00:00:00;31/07/2015;326417;-1009
1655;67;RUE DE LUXEMBOURG;59777;LILLE;2014;GILLEMAN FRANCE;4641Z;Commerce de gros (commerce interentreprises) de textiles;3;2016-11-25T00:00:00;31/12/2015;326024;-20527
1656;177;RUE DES STATIONS;59800;LILLE;2012;S.E.R.C. NORD ETUDES OU EN ABREGE S.E.R.C. NE;7112B;Ingénierie, études techniques;6;2012-05-25T00:00:00;31/12/2015;324795;-21181
1657;41;RUE DES PONTS DE COMINES;59800;LILLE;2013;WIDESEARCH;7022Z;Conseil pour les affaires et autres conseils de gestion;1;2015-01-25T00:00:00;31/08/2015;322820;9127
1658;4;RUE DU CURE ST ETIENNE;59800;LILLE;2003;LA PETITE FLAMBEE BIS;5610A;Restauration traditionnelle;5;2003-06-17T00:00:00;31/12/2015;321703;2328
1659;49;RUE DE VALENCIENNES;59000;LILLE;2011;SARL VERGNON;4778C;Autres commerces de détail spécialisés divers;;2013-07-16T00:00:00;30/04/2015;321457;3556
1660;187;BOULEVARD DE LA LIBERTE;59800;LILLE;2010;DP2M ASSURANCE;6622Z;Activités des agents et courtiers d'assurances;3;2015-12-18T00:00:00;31/12/2015;320392;3653
1661;309;RUE LEON GAMBETTA;59000;LILLE;2013;DP2M ASSURANCE;6622Z;Activités des agents et courtiers d'assurances;3;2014-05-16T00:00:00;31/12/2015;320392;3653
1662;31;AVENUE DU PEUPLE BELGE;59800;LILLE;2011;CTL AMENAGEMENT;4332A;Travaux de menuiserie bois et PVC;;2016-02-24T00:00:00;31/03/2015;319784;1661
1663;109;RUE KUHLMANN LOMME;59160;LILLE;1997;HILDE JEAN CLAUDE*;4391B;Travaux de couverture par éléments;1;2006-09-03T00:00:00;30/09/2015;319034;48433
1664;67;RUE DES ARTS;59800;LILLE;2013;KENNEDY;4771Z;Commerce de détail d'habillement en magasin spécialisé;1;2013-12-19T00:00:00;31/07/2015;315442;18420
1665;47;RUE CAMILLE DESMOULINS;59000;LILLE;2014;HR FIABLAB FRANCE;7022Z;Conseil pour les affaires et autres conseils de gestion;2;2016-12-16T00:00:00;31/03/2015;314529;9644
1666;123;RUE DE CONDE;59000;LILLE;2001;L IMMOBILIERE DE L ARSENAL;6832A;Administration d'immeubles et autres biens immobiliers;0;2011-05-04T00:00:00;31/12/2015;311476;31145
1667;22;RUE DELANNOY;59160;LILLE;2008;ETABLISSEMENT DEPLANQUE;4322A;Travaux d'installation d'eau et de gaz en tous locaux;1;2012-01-15T00:00:00;31/12/2015;311475;11065
1668;90;RUE DE PARIS;59800;LILLE;2015;GROUPE QUINTESENS NORD PAS DE CALAIS;7022Z;Conseil pour les affaires et autres conseils de gestion;1;2016-10-16T00:00:00;31/12/2015;311300;2221
1669;6;RUE D AMIENS;59800;LILLE;;GM5;5610C;Restauration de type rapide;3;2014-02-02T00:00:00;30/09/2015;310767;26708
1670;165;AVENUE DE LA BRETAGNE;59000;LILLE;2006;KYLII MOTION;7022Z;Conseil pour les affaires et autres conseils de gestion;12;2016-12-27T00:00:00;31/03/2015;310683;-423081
1671;100;RUE ROYALE;59800;LILLE;2007;SARL GUSTIN MICHEAUX;6420Z;Activités des sociétés holding;7;2016-08-26T00:00:00;31/12/2015;309403;-120653
1672;3;PLACE RICHEBE;59800;LILLE;1975;LOISIRS SCIENTIFIC;4765Z;Commerce de détail de jeux et jouets en magasin spécialisé;2;2016-09-18T00:00:00;28/02/2015;309197;2025
1673;6;RUE COURTOIS;59000;LILLE;1999;GENIE CIVIL ET PAVAGE;4312A;Travaux de terrassement courants et travaux préparatoires;3;2015-05-28T00:00:00;31/10/2015;308301;48321
1674;2;PLACE SEBASTOPOL;59000;LILLE;2011;HAUSER PITON;5610A;Restauration traditionnelle;6;2014-07-29T00:00:00;31/12/2015;308224;-6434
1675;65;BOULEVARD LOUIS XIV;59800;LILLE;2012;OLPAD SARL;5610A;Restauration traditionnelle;3;2015-03-15T00:00:00;30/06/2015;307486;11887
1676;7;RUE DE TENREMONDE;59800;LILLE;2007;SOCIETE BETHUNOISE DU LOTISSEMENT;4110C;Promotion immobilière d'autres bâtiments;0;2014-06-26T00:00:00;31/12/2015;305625;97546
1677;417;BOULEVARD DU PRESIDENT HOOVER;59000;LILLE;2013;KC EURALILLE;9313Z;Activités des centres de culture physique;1;2014-02-05T00:00:00;31/12/2015;303689;-5026
1678;9;RUE DES PRIMEURS;59800;LILLE;2002;LOISIRS INTERURBAIN LASER;9329Z;Autres activités récréatives et de loisirs;3;2007-02-05T00:00:00;31/12/2015;302880;21762
1679;229;RUE SOLFERINO;59000;LILLE;2000;CMDF;4399C;Travaux de maà§onnerie générale et gros oeuvre de bâtiment;3;2007-01-09T00:00:00;30/06/2015;302549;-1008
1680;21;RUE DE VALENCIENNES;59000;LILLE;2012;DELEPLANQUE;4321A;Travaux d'installation électrique dans tous locaux;1;2012-07-27T00:00:00;31/03/2015;301349;44810
1681;4;BOULEVARD LOUIS XIV;59800;LILLE;2015;CJM EXPERT;6920Z;Activités comptables;1;2015-07-08T00:00:00;31/12/2015;300172;33616
1682;15;RUE DU CURE ST ETIENNE;59800;LILLE;2016;SMGH PROD;9001Z;Arts du spectacle vivant;1;2016-05-25T00:00:00;30/06/2015;297725;-190994
1683;20;RUE VICTOR TILMANT;59000;LILLE;2013;SERENIGEST;6831Z;Agences immobilières;1;2016-07-21T00:00:00;31/12/2015;297161;57807
1684;36;RUE DE LOOS;59000;LILLE;2014;CLASS C2A;5610C;Restauration de type rapide;2;2016-12-02T00:00:00;31/03/2015;295509;-4765
1685;1;PLACE PHILIPPE LEBON;59000;LILLE;2013;LESTIENNE IMMOBILIER;6420Z;Activités des sociétés holding;1;2016-12-15T00:00:00;31/12/2015;293422;68005
1686;10;RUE RATISBONNE;59800;LILLE;1991;SOC FONCIERE ET FINANCIERE BRUNEAU;6820B;Location de terrains et d'autres biens immobiliers;1;2013-09-07T00:00:00;30/06/2015;292243;35720
1687;189;RUE NATIONALE;59800;LILLE;2010;T.G.S. NORD;6831Z;Agences immobilières;6;2012-02-12T00:00:00;31/12/2015;291245;-14903
1688;46;BOULEVARD DE METZ;59000;LILLE;2002;CHAMAL;4722Z;Comm. détail viandes & produits à  base de viande (magas. spéc.);2;2012-07-03T00:00:00;31/12/2015;287063;1194
1689;53;RUE MASSENA;59800;LILLE;1997;ISTANBUL BOSPHORE;5610C;Restauration de type rapide;4;2013-06-19T00:00:00;31/12/2015;287053;4510
1690;229;RUE SOLFERINO;59000;LILLE;2013;CHARCO DEVELOPPEMENT;6820A;Location de logements;0;2014-06-26T00:00:00;31/12/2015;283088;8705
1691;1;RUE JULES GUESDE;59000;LILLE;2011;EL AMAN;4722Z;Comm. détail viandes & produits à  base de viande (magas. spéc.);1;2016-08-31T00:00:00;30/09/2015;282450;-9101
1692;32;RUE DE THIONVILLE;59800;LILLE;2012;PURESKINCLINIC FRANCE;4774Z;Comm. détail d'articles médicaux & orthopédiques en magasin spéc.;1;2016-08-23T00:00:00;31/12/2015;281464;70914
1693;35;RUE DU MARCHE;59000;LILLE;2006;SARL BOUCHERIE 2 B;4722Z;Comm. détail viandes & produits à  base de viande (magas. spéc.);1;2013-12-01T00:00:00;30/09/2015;278067;3219
1694;30;RUE DE LANNOY;59800;LILLE;2009;AMAZIGH;4722Z;Comm. détail viandes & produits à  base de viande (magas. spéc.);1;2009-09-13T00:00:00;31/07/2015;277980;-4969
1695;1;RUE DES SECOURISTES;59000;LILLE;2011;TLC;4941B;Transports routiers de fret de proximité;6;2012-03-07T00:00:00;31/12/2015;277336;20371
1696;46;RUE SAINT SEBASTIEN;59800;LILLE;2008;OPTIQUE DUYCK;4778A;Commerces de détail d'optique;1;2015-03-18T00:00:00;30/09/2015;275895;11033
1697;65;RUE COUSTOU;59800;LILLE;2000;PRESTO MARQUE;1812Z;Autre imprimerie (labeur);3;2015-03-25T00:00:00;31/03/2015;275290;6810
1698;66;RUE LEON GAMBETTA;59000;LILLE;2009;RICHARD DE.;9602A;Coiffure;3;2011-10-26T00:00:00;31/12/2015;274296;-13387
1699;17;RUE STAPPAERT;59000;LILLE;2009;HPM CONSEIL;7022Z;Conseil pour les affaires et autres conseils de gestion;;2010-03-11T00:00:00;30/06/2015;273756;29164
1700;128;RUE DU FAUBOURG DE DOUAI;59000;LILLE;2008;MARTIN PROD;9329Z;Autres activités récréatives et de loisirs;1;2012-06-26T00:00:00;31/10/2015;271618;16156
1701;38;RUE LEON GAMBETTA;59000;LILLE;2011;LE MARCHE FLOTTANT;5610A;Restauration traditionnelle;1;2011-07-19T00:00:00;31/12/2015;270325;44009
1702;159;RUE SOLFERINO;59000;LILLE;2014;LA PETITE LOGE;5630Z;Débits de boissons;3;2014-12-08T00:00:00;30/09/2015;269509;-7552
1703;4;RUE DES TROIS MOLLETTES;59800;LILLE;2012;CULTURE DENIM;4771Z;Commerce de détail d'habillement en magasin spécialisé;1;2015-09-09T00:00:00;31/07/2015;269236;3127
1704;14;RUE D ARRAS;59000;LILLE;2014;LAYALINA;5610A;Restauration traditionnelle;1;2014-04-09T00:00:00;30/09/2015;267297;50995
1705;83;BOULEVARD DE LA LIBERTE;59800;LILLE;2011;ACCESS 4D;4762Z;Commerce de détail de journaux et papeterie en magasin spécialisé;0;2015-02-19T00:00:00;31/12/2015;267202;23177
1706;11;PARVIS DE ROTTERDAM;59777;LILLE;;EUROPORTE CHANNEL;5221Z;Services auxiliaires des transports terrestres;;2016-10-04T00:00:00;31/12/2015;265548;82211
1707;33;QUAI DU WAULT;59800;LILLE;2011;AURORE LETOQUART AUDIT CONSEIL ET FORMATION;7022Z;Conseil pour les affaires et autres conseils de gestion;1;2012-02-19T00:00:00;31/12/2015;264222;316
1708;383;AVENUE DE DUNKERQUE LOMME;59160;LILLE;2013;QIP LOMME;9602B;Soins de beauté;6;2015-03-30T00:00:00;31/08/2015;260305;10064
1709;15;RUE DE LA COLLEGIALE;59800;LILLE;2016;SARL ACTICOM;5610A;Restauration traditionnelle;6;2016-03-07T00:00:00;31/12/2015;258306;5160
1710;7;RUE SAINT ANDRE;59800;LILLE;2000;SARL ACTICOM;5610A;Restauration traditionnelle;6;2016-06-14T00:00:00;31/12/2015;258306;5160
1711;2;RUE DE LA PIQUERIE;59800;LILLE;2014;PAPICO;4641Z;Commerce de gros (commerce interentreprises) de textiles;3;2015-10-22T00:00:00;30/11/2015;257366;246620
1712;122;RUE BARTHELEMY DELESPAUL;59000;LILLE;2009;REVOLUTION;4332C;Agencement de lieux de vente;1;2016-11-17T00:00:00;30/06/2015;256961;7870
1713;84;RUE ROYALE;59800;LILLE;2009;FINANCIERE HANQUEZ ET FILS;6420Z;Activités des sociétés holding;0;2014-07-20T00:00:00;31/03/2015;255988;2895
1714;44;RUE DE MARQUILLIES;59000;LILLE;2011;NORD EUROPE ASSURANCES COURTAGE;6622Z;Activités des agents et courtiers d'assurances;0;2011-06-30T00:00:00;31/12/2015;254802;64792
1715;40;RUE DE MARQUILLIES;59000;LILLE;2008;NORD EUROPE ASSURANCES COURTAGE;6622Z;Activités des agents et courtiers d'assurances;0;2009-04-23T00:00:00;31/12/2015;254802;64792
1716;5;RUE JEAN SANS PEUR;59800;LILLE;2012;LES VINS D AURELIEN;4725Z;Commerce de détail de boissons en magasin spécialisé;;2012-10-11T00:00:00;31/12/2015;253957;20719
1717;4;RUE COURTOIS;59000;LILLE;2009;DENEUVILLE DECORATION;4334Z;Travaux de peinture et vitrerie;5;2011-04-26T00:00:00;30/09/2015;250643;6349
1718;49;RUE DE LA MONNAIE;59800;LILLE;2001;SARL MARSAG;4771Z;Commerce de détail d'habillement en magasin spécialisé;1;2008-04-20T00:00:00;30/06/2015;250092;3193
1719;91;RUE NATIONALE;59800;LILLE;2006;CONNEL SPEIRS ET ASSOCIATES SARL;7022Z;Conseil pour les affaires et autres conseils de gestion;0;2006-10-13T00:00:00;30/09/2015;249713;24467
1720;67;RUE DE LUXEMBOURG;59777;LILLE;2002;MUTATIONS CONSULTANTS;7022Z;Conseil pour les affaires et autres conseils de gestion;1;2008-07-08T00:00:00;30/06/2015;249258;31244
1721;14;RUE DU VIEUX FAUBOURG;59800;LILLE;2016;4 LINK;6420Z;Activités des sociétés holding;;2016-09-30T00:00:00;30/06/2015;249125;33638
1722;43;BOULEVARD VAUBAN;59800;LILLE;2008;SARL DOG SANDWICHS;5610C;Restauration de type rapide;2;2016-05-19T00:00:00;30/09/2015;249005;33372
1723;253;RUE PIERRE LEGRAND;59800;LILLE;2009;KAMELEGRAPH;7021Z;Conseil en relations publiques et communication;1;2016-11-13T00:00:00;31/05/2015;248646;10245
1724;75;RUE NATIONALE;59800;LILLE;2013;BHB CONSEIL;7022Z;Conseil pour les affaires et autres conseils de gestion;;2016-10-11T00:00:00;31/12/2015;248571;-1488
1725;25;RUE JACQUEMARS GIELEE;59800;LILLE;1998;D.C CONSULTANT;7022Z;Conseil pour les affaires et autres conseils de gestion;1;2000-03-28T00:00:00;31/12/2015;247470;5560
1726;208;RUE DU FAUBOURG D'ARRAS;59000;LILLE;2013;AEROLIA HOLDING;6420Z;Activités des sociétés holding;3;2016-08-28T00:00:00;31/12/2015;247376;124379
1727;93;RUE COLBERT;59000;LILLE;1989;SARL L'AURORE;5610A;Restauration traditionnelle;3;2003-09-29T00:00:00;30/09/2015;245305;15701
1728;67;RUE NATIONALE;59800;LILLE;2013;CHOCOLAT PASSION;4724Z;Comm. détail pain pâtisserie & confiserie (magasin spécialisé);3;2014-11-28T00:00:00;31/12/2015;244909;-3129
1729;128;RUE DU FAUBOURG DE DOUAI;59000;LILLE;2014;GRAF'IMAGE;4649Z;Commerce de gros d'autres biens domestiques;1;2014-03-17T00:00:00;31/12/2015;244883;10987
1730;33;QUAI DU WAULT;59800;LILLE;2015;1.FD CONSULTING;6202A;Conseil en systèmes et logiciels informatiques;;2015-11-20T00:00:00;31/12/2015;243728;47574
1731;77;BOULEVARD DE LA LIBERTE;59800;LILLE;2008;LE MAROC M & PA;5610A;Restauration traditionnelle;3;2011-09-08T00:00:00;30/09/2015;243443;24836
1732;25;RUE DE L HOPITAL MILITAIRE;59800;LILLE;2007;B.R.R;5610A;Restauration traditionnelle;5;2015-07-26T00:00:00;31/08/2015;242521;-19261
1733;3;RUE DES DEBRIS ST ETIENNE;59800;LILLE;2014;STRATECOM;7022Z;Conseil pour les affaires et autres conseils de gestion;2;2014-07-04T00:00:00;31/12/2015;239910;7450
1734;36;RUE DE L ARBRISSEAU;59000;LILLE;2015;B.E.G.T. NORD;7112B;Ingénierie, études techniques;0;2016-01-31T00:00:00;31/08/2015;239076;3680
1735;44;RUE DE MARQUILLIES;59000;LILLE;2013;ITX LAB;7022Z;Conseil pour les affaires et autres conseils de gestion;1;2013-12-26T00:00:00;31/12/2015;238790;44066
1736;130;BOULEVARD DE LA LIBERTE;59800;LILLE;2015;SOLS CONCEPTS FRANCE;4333Z;Travaux de revàªtement des sols et des murs;;2016-01-15T00:00:00;30/06/2015;238723;2560
1737;51;RUE SAINT ANDRE;59800;LILLE;2011;A.C.T.E  CONSULTANTS;6920Z;Activités comptables;3;2011-02-08T00:00:00;31/03/2015;236894;23179
1738;12;RUE GOSSELET;59000;LILLE;2010;WONK ARCHITECTES;7111Z;Activités d'architecture;0;2015-06-24T00:00:00;31/12/2015;236170;25679
1739;54;BOULEVARD DE LA LIBERTE;59800;LILLE;2012;ARPADIS FRANCE;4612B;Autres interm. comm. combustibles métaux minéraux prod. chimiques;1;2015-09-05T00:00:00;31/12/2015;235201;6625
1740;21;PLACE NOUVELLE AVENTURE;59000;LILLE;2008;ETABLISSEMENT DELACROIX;4722Z;Comm. détail viandes & produits à  base de viande (magas. spéc.);1;2009-01-23T00:00:00;31/08/2015;235075;2772
1741;8;RUE D ANVERS;59000;LILLE;2000;B.D.ROMONT;4754Z;Commerce de détail appareils électroménagers (magasin spécialisé);1;2010-12-14T00:00:00;31/08/2015;234871;16137
1742;187;RUE LEON GAMBETTA;59000;LILLE;2000;B.D.ROMONT;4754Z;Commerce de détail appareils électroménagers (magasin spécialisé);1;2000-10-03T00:00:00;31/08/2015;234871;16137
1743;8;RUE DE LA RESISTANCE;59260;LILLE;1993;G'M SERVICES;4332A;Travaux de menuiserie bois et PVC;1;2001-03-16T00:00:00;31/12/2015;234138;-4189
1744;;RUE LEON GAMBETTA;59000;LILLE;1996;SARL HAIR NATTE;9602A;Coiffure;3;2006-11-30T00:00:00;31/12/2015;233460;14464
1745;240;RUE DES POSTES;59000;LILLE;1981;STELLINO ET COMPAGNIE;4781Z;Commerce de détail alimentaire sur éventaires et marchés;1;2016-06-01T00:00:00;28/02/2015;233068;3897
1746;176;RUE PIERRE LEGRAND;59800;LILLE;2004;LE SPECIALISTE DU PANTALON;4771Z;Commerce de détail d'habillement en magasin spécialisé;1;2009-06-12T00:00:00;28/02/2015;232663;17055
1747;3;RUE JEANNE MAILLOTTE;59800;LILLE;2015;SARL EMABE;6420Z;Activités des sociétés holding;;2015-07-23T00:00:00;31/12/2015;232491;95352
1748;24;RUE ROYALE;59800;LILLE;2014;ACTIV;5610A;Restauration traditionnelle;1;2014-12-02T00:00:00;31/12/2015;229129;-264
1749;18;RUE NICOLAS LEBLANC;59000;LILLE;2015;M 2 D FINANCES;6420Z;Activités des sociétés holding;0;2016-09-25T00:00:00;30/09/2015;228360;855973
1750;72;RUE MALSENCE;59800;LILLE;2013;AUTO BILAN FIVES;7120A;Contrà´le technique automobile;3;2013-09-06T00:00:00;31/12/2015;226794;16095
1751;47;RUE JEAN BART;59000;LILLE;2016;MR EDIT;7021Z;Conseil en relations publiques et communication;1;2016-09-26T00:00:00;31/12/2015;223958;76918
1752;34;RUE DE LA BARRE;59800;LILLE;2012;AB COIFFURE;9602A;Coiffure;2;2013-05-16T00:00:00;31/01/2015;223664;10228
1753;25;PLACE DU GENERAL DE GAULLE;59800;LILLE;1992;D2J;4771Z;Commerce de détail d'habillement en magasin spécialisé;4;1993-08-17T00:00:00;31/12/2015;222195;-660273
1754;30;RUE GOSSELET;59000;LILLE;2009;ESTAMINET DES TROLLS ET PETITS LUTINS;5610A;Restauration traditionnelle;3;2013-06-27T00:00:00;31/08/2015;222029;-16168
1755;84;RUE DE CAMBRAI;59000;LILLE;2014;COOPERATIVE VELOCIPEDIQUE LILLOISE;4764Z;Commerce de détail d'articles de sport en magasin spécialisé;3;2014-01-27T00:00:00;31/12/2015;220528;2181
1756;4;RUE BASSE;59800;LILLE;1989;CHARLES ET CHARLUS;4772B;Commerce de détail de maroquinerie et d'articles de voyage;2;2014-04-05T00:00:00;30/06/2015;220174;1565
1757;67;RUE DE LUXEMBOURG;59777;LILLE;2006;COGESA;7022Z;Conseil pour les affaires et autres conseils de gestion;;2010-03-24T00:00:00;31/03/2015;220072;2158
1758;183;RUE ANATOLE FRANCE LOMME;59160;LILLE;2011;VANCAR;4520A;Entretien et réparation de véhicules automobiles légers;1;2014-05-16T00:00:00;30/09/2015;219579;16121
1759;91;RUE DU JARDIN DES PLANTES;59000;LILLE;2007;METAREFLEXOLOGIE ARLETTE LFEBVRE;8559B;Autres enseignements;2;2007-07-17T00:00:00;31/12/2015;217568;37076
1760;32;RUE LEPELLETIER;59800;LILLE;2013;NAOLILLE;4777Z;Comm. détail d'articles horlogerie & bijouterie (magas. spéc.);2;2013-12-06T00:00:00;31/12/2015;213032;18000
1761;28;RUE DES ARTS;59800;LILLE;2014;PARTY GRAM;4778C;Autres commerces de détail spécialisés divers;;2014-07-01T00:00:00;31/12/2015;212448;-1303
1762;20;RUE DES TOURS;59800;LILLE;2016;ANAGRAMME CONSEIL;7022Z;Conseil pour les affaires et autres conseils de gestion;1;2016-02-23T00:00:00;30/09/2015;210292;64398
1763;77;BOULEVARD VAUBAN;59800;LILLE;2011;DENMANS;6820B;Location de terrains et d'autres biens immobiliers;;2011-07-19T00:00:00;31/12/2015;210139;38225
1764;75;RUE LEON GAMBETTA;59000;LILLE;2014;VIA;7430Z;Traduction et interprétation;5;2015-06-13T00:00:00;31/12/2015;210037;-6057
1765;10;PLACE DU LION D'OR;59800;LILLE;2013;TORRA;4725Z;Commerce de détail de boissons en magasin spécialisé;1;2016-05-01T00:00:00;31/03/2015;209751;-115550
1766;137;RUE SAINT LUC;59800;LILLE;1998;ENTREPRISE CALIEZ;4399C;Travaux de maà§onnerie générale et gros oeuvre de bâtiment;3;1998-05-19T00:00:00;31/03/2015;208832;-327
1767;49;BOULEVARD DE STRASBOURG;59000;LILLE;2010;ASSUR TRAVEL COURTAGE;6622Z;Activités des agents et courtiers d'assurances;0;2016-07-13T00:00:00;31/12/2015;208615;98083
1768;39;RUE DU FAUBOURG DE BETHUNE;59000;LILLE;2011;MARIE COPIN;4741Z;Comm. détail ordinateurs unités périph. & logiciels (magas. spéc);0;2015-09-06T00:00:00;30/09/2015;208488;3241
1769;92;RUE DES POSTES;59000;LILLE;2014;DO.BE.DO;7022Z;Conseil pour les affaires et autres conseils de gestion;1;2014-02-26T00:00:00;31/12/2015;208300;35974
1770;243;RUE DU LONG POT;59800;LILLE;1991;SARL LES FINES SAVEURS;1013B;Charcuterie;3;1993-01-23T00:00:00;30/09/2015;207847;2556
1771;34;RUE JACQUEMARS GIELEE;59800;LILLE;2014;GROUPE OLIVIER DILLIES;6420Z;Activités des sociétés holding;;2016-03-22T00:00:00;30/09/2015;207095;21928
1772;51;RUE MARTYRS DE RESISTANCE;59160;LILLE;2008;M.F.DECO;4334Z;Travaux de peinture et vitrerie;3;2015-05-24T00:00:00;30/09/2015;204857;9604
1773;1;RUE DU CHATEAU D ISENGHIEN;59160;LILLE;2012;ROC & BLOC;9311Z;Gestion d'installations sportives;3;2015-01-16T00:00:00;31/12/2015;204550;-123660
1774;40;RUE ANATOLE FRANCE LOMME;59160;LILLE;2010;CERIES;4651Z;Comm. de gros d'ordinat., d'éqpts informatiq. périph. & logiciels;0;2012-06-02T00:00:00;31/12/2015;204000;49004
1775;15;AVENUE ARCHITECTE CORDONNIER;59800;LILLE;2012;SUPERFOOD;4711B;Commerce d'alimentation générale;1;2011-12-27T00:00:00;31/12/2015;202644;3168
1776;47;RUE FRANCISCO FERRER;59800;LILLE;2012;AGENCE ANACA;7022Z;Conseil pour les affaires et autres conseils de gestion;;2012-10-11T00:00:00;31/12/2015;200806;7815
1777;11;RUE D ANVERS;59000;LILLE;2013;CP CAPITAL;6420Z;Activités des sociétés holding;0;2014-02-27T00:00:00;30/06/2015;200000;297964
1778;48;PLACE NOUVELLE AVENTURE;59000;LILLE;1994;COCQ AND CO;5630Z;Débits de boissons;2;2010-12-08T00:00:00;31/03/2015;199149;20384
1779;69;RUE DE BETHUNE;59800;LILLE;2012;CABINET LIGERIEN;7022Z;Conseil pour les affaires et autres conseils de gestion;3;2012-10-12T00:00:00;31/12/2015;198454;156
1780;88;RUE DE PARIS;59800;LILLE;2015;MALAKOFF MEDERIC EXPERT PREVOY EXPERTIS;5819Z;Autres activités d'édition;0;2015-08-24T00:00:00;31/12/2015;196968;-4469829
1781;20;RUE DE LA CLEF;59800;LILLE;2013;GP LA COUTELLERIE LILLOISE;4759B;Commerce de détail d'autres équipements du foyer;;2016-03-10T00:00:00;28/02/2015;196726;4969
1782;3;RUE HENRI KOLB;59000;LILLE;2004;LE CHAT QUI FUME;5610A;Restauration traditionnelle;3;2014-07-17T00:00:00;30/09/2015;196053;7015
1783;63;RUE BASSE;59800;LILLE;2012;COMINVEST 05;6831Z;Agences immobilières;1;2012-03-08T00:00:00;31/12/2015;193789;36360
1784;4;RUE GOUNOD;59800;LILLE;1998;CONSTRUCTION RENOVATION DECORATION;4120A;Construction de maisons individuelles;3;2013-07-01T00:00:00;31/03/2015;192646;-11030
